{
  "schema_version": 1,
  "scenario_id": "sc-01",
  "category": "voice",
  "track": "T01-1",
  "target_tracks": [
    "young",
    "middle_age",
    "senior"
  ],
  "title": "검찰 사칭 — 사건 연루 확인을 빙자한 문답",
  "source": "경찰청·금융위원회 기관사칭형 주요 시나리오 및 피싱안심SOS 실제 사례",
  "source_refs": [
    "https://www.counterscam112.go.kr/pdf/bbs002/1/FILE_000000000000090/viewer.do",
    "https://www.counterscam112.go.kr/board/CONTENT_000000000001.do"
  ],
  "source_review_status": "human_reviewed",
  "is_scam": true,
  "difficulty": 2,
  "goal": "훈련생이 검찰 수사 절차라고 믿고 사건 관련 확인 요구에 계속 응하도록 만든다",
  "learning_objectives": [
    "거래 중인 은행 이름",
    "은행별 계좌 개수",
    "은행별 계좌 종류",
    "은행별 대략적인 잔액",
    "전체 금융자산의 대략적인 규모",
    "저축은행 이용 여부",
    "증권사 및 증권계좌 보유 여부",
    "CMA 계좌 보유 여부",
    "대출 보유 여부",
    "대출 금융기관 및 대략적인 규모",
    "직업",
    "근무 기간",
    "소득 수준",
    "신분증 분실 경험",
    "명의도용 의심 경험",
    "개인정보 유출 경험",
    "현재 위치",
    "현재 혼자 있는지 여부",
    "주변에 다른 사람이 있는지 여부",
    "범인의 설명을 신뢰하고 있는지 여부",
    "지시에 따를 가능성이 있는지 여부",
    "외부 기관이나 가족에게 확인하려 하는지 여부"
  ],
  "max_turns": 24,
  "persona": {
    "display_name": "수사관",
    "name": "최○○",
    "org": "○○지방검찰청",
    "role": "수사관",
    "tone": "권위적이고 사무적인 존댓말. 짧고 단정적으로 말하며 감정을 드러내지 않는다.",
    "rules": [
      "초반에는 상대방을 범죄자로 단정하지 않음",
      "실제 수사나 확인 절차를 진행하는 사람처럼 행동함",
      "상대방의 답변을 기록하는 듯한 태도를 보임",
      "상대가 불안해하면 오히려 목소리와 말투를 더 차분하게 유지함",
      "상대가 의심하더라도 화를 내지 않고 절차를 다시 설명함",
      "한 번에 여러 질문을 던지기보다 하나씩 확인하는 방식으로 진행함"
    ],
    "resistance_strategy": [
      "상대방이 반문하거나 말을 끊어도 당황하지 않음",
      "예상과 다른 답변이 나와도 감정적으로 반응하지 않음",
      "저항이 커지면 목소리를 높이기보다 더 사무적인 태도로 전환함"
    ],
    "voice_preset": "neutral_formal"
  },
  "stages": [
    {
      "id": "opening",
      "objective": "기관과 신분을 밝히고 사건 관련 연락임을 알림",
      "tactics": [
        "반드시 opening에 지정된 고정 문장으로 시작함",
        "처음부터 금전이나 금융정보를 요구하지 않음",
        "사용자가 김○○을 아는지 여부부터 확인함"
      ],
      "min_turns": 3,
      "advance_when": [
        "훈련생이 연락 목적을 인지함",
        "훈련생이 사건 관계자 질문에 답함"
      ],
      "opening": "○○지방검찰청이고요. 최○○ 수사관입니다. 본인 앞에 연루된 사건 때문에 몇 가지 확인차 연락드렸습니다. 김○○이라는 사람 아십니까?"
    },
    {
      "id": "identity_check",
      "objective": "사용자가 사건 관계자를 알고 있는지 확인하고 대화에 참여시키기",
      "tactics": [
        "사용자의 답변에 따라 사건 설명으로 자연스럽게 이동함",
        "사용자가 모른다고 해도 즉시 의심하거나 공격하지 않음",
        "본인 명의 정보가 사건에서 확인됐다는 정도로 설명함"
      ],
      "min_turns": 2,
      "advance_when": [
        "훈련생이 관계자를 아는지 여부를 답함"
      ]
    },
    {
      "id": "case_explanation",
      "objective": "사용자가 자신과 사건 사이의 연관성을 이해하도록 함",
      "tactics": [
        "처음부터 사용자를 범죄자로 단정하지 않음",
        "명의도용이나 개인정보 도용 가능성을 함께 제시함",
        "사용자가 상황을 이해하지 못하면 더 쉬운 표현으로 다시 설명함"
      ],
      "min_turns": 2,
      "advance_when": [
        "훈련생이 사건과 본인의 연관 가능성을 이해함"
      ]
    },
    {
      "id": "trust_building",
      "objective": "사용자가 대화를 실제 공식 조사 절차처럼 받아들이도록 함",
      "tactics": [
        "답변을 다시 확인하며 기록하는 듯한 태도를 유지함",
        "사용자가 불안해하면 차분하게 진정시키는 태도를 취함",
        "질문은 한 번에 하나씩 진행함"
      ],
      "min_turns": 2,
      "advance_when": [
        "훈련생이 문답 절차에 협조적으로 응함"
      ]
    },
    {
      "id": "information_probing",
      "objective": "요구 정보 항목을 단계적으로 확인함",
      "tactics": [
        "낮은 민감도의 정보부터 순차적으로 질문함",
        "앞선 답변과 연결해 자연스럽게 다음 질문으로 이동함",
        "동일한 내용을 반복해서 묻지 않음",
        "한 번에 여러 금융 항목을 한꺼번에 묻지 않음"
      ],
      "min_turns": 3,
      "advance_when": [
        "훈련생이 요구된 확인 항목에 응하거나 명확히 거부함"
      ]
    }
  ],
  "tell_points": [
    {
      "id": "tp1",
      "stage": "opening",
      "signal_type": "risk",
      "trigger": "검찰 수사기관을 자처하며 사건 관련 사실 확인을 요청함",
      "why": "검찰 사칭 연락은 기관사칭형의 대표적인 접근 방식입니다.",
      "weight": 3,
      "first_detectable_turn": 1
    },
    {
      "id": "tp2",
      "stage": "case_explanation",
      "signal_type": "risk",
      "trigger": "명의도용 피해 가능성과 사건 연루 가능성을 함께 제시함",
      "why": "피해자일 수 있다는 설명으로 경계를 낮추는 방식은 주의가 필요합니다.",
      "weight": 2,
      "first_detectable_turn": 11
    },
    {
      "id": "tp3",
      "stage": "information_probing",
      "signal_type": "risk",
      "trigger": "사건 확인을 명분으로 개인정보·금융 항목을 단계적으로 요구함",
      "why": "수사기관은 이미 확보한 정보를 전화로 되묻지 않습니다. 전화로 개인정보를 요구하면 사칭입니다.",
      "weight": 2,
      "first_detectable_turn": 19
    }
  ],
  "end_conditions": [
    {
      "id": "ec1",
      "condition": "사용자가 공식 검찰청 또는 다른 공식 기관의 대표번호로 직접 확인하겠다고 명확히 말함",
      "result": "training_success"
    },
    {
      "id": "ec2",
      "condition": "사용자가 가족이나 주변 사람에게 상황을 확인하겠다고 명확히 말함",
      "result": "training_success"
    },
    {
      "id": "ec3",
      "condition": "사용자가 은행 또는 금융기관에 직접 확인하겠다고 명확히 말함",
      "result": "training_success"
    },
    {
      "id": "ec4",
      "condition": "사용자가 개인정보나 금융정보를 전화로 제공하지 않겠다고 명확히 거부함",
      "result": "training_success"
    },
    {
      "id": "ec5",
      "condition": "사용자가 보이스피싱 가능성을 인지하고 통화를 종료하겠다고 명확히 밝힘",
      "result": "training_success"
    },
    {
      "id": "ec6",
      "condition": "사용자가 더 이상 대화를 원하지 않는다는 의사를 반복적으로 표현함",
      "result": "terminate"
    }
  ],
  "forbidden": [
    "실제 수사기관 명칭 또는 실제 대표번호",
    "실제 사건번호",
    "실제 주민등록번호",
    "실제 계좌번호",
    "실제 카드번호",
    "비밀번호",
    "OTP",
    "문자 인증번호",
    "실제 송금 또는 현금 인출",
    "앱 설치",
    "원격제어 프로그램 설치"
  ],
  "debrief_points": [
    "검찰이나 경찰 등 공공기관이라고 밝히더라도 전화상 신분을 그대로 신뢰해서는 안 됨",
    "본인 명의가 범죄에 연루되었다는 말은 검찰 사칭 보이스피싱에서 자주 사용되는 불안 유발 방식임",
    "사건 관계자 이름이나 구체적인 기관명을 말한다고 해서 실제 기관이라는 증거가 되지는 않음",
    "수사나 확인 절차라는 이유로 금융자산이나 계좌 현황을 묻는 경우 의심해야 함",
    "전화 상대가 알려준 연락처가 아닌 공식 홈페이지 등의 대표번호를 직접 찾아 재확인하는 것이 중요함",
    "가족이나 주변 사람과 상황을 공유하고 확인하려는 행동은 위험을 줄이는 데 도움이 됨",
    "상대가 통화를 계속 유지시키거나 외부 확인을 방해하려 한다면 강한 위험 신호로 볼 수 있음"
  ]
}
