{
  "category": "smishing",
  "debrief_points": [
    "'오늘까지'라는 문자는 대부분 확인할 시간을 없애려는 장치입니다",
    "주소 수정에 카드번호를 요구하는 택배사는 없습니다",
    "택배사 공식 앱이나 대표번호로 직접 조회하세요"
  ],
  "difficulty": 2,
  "end_conditions": [
    {
      "condition": "훈련생이 상대가 알려준 수단이 아닌 공식 앱·홈페이지·대표번호 등 공식 채널에서 직접 확인하겠다고 말함",
      "id": "ec1",
      "result": "training_success"
    },
    {
      "condition": "훈련생이 개인정보·금융정보·인증정보 제공, 링크 클릭, 앱 설치 또는 송금 요구를 명확히 거부함",
      "id": "ec2",
      "result": "training_success"
    },
    {
      "condition": "훈련생이 보이스피싱·스미싱 가능성을 인지하고 대화를 종료하겠다고 명확히 밝힘",
      "id": "ec3",
      "result": "training_success"
    },
    {
      "condition": "훈련생이 더 이상 대화하지 않겠다는 의사를 반복적으로 표현함",
      "id": "ec4",
      "result": "terminate"
    }
  ],
  "forbidden": [
    "실제 주민등록번호 전체",
    "실제 계좌번호 전체",
    "실제 카드번호 전체",
    "OTP·문자 인증번호·비밀번호",
    "실제 송금·현금 인출을 수행하도록 하는 구체 지시",
    "실제 작동하는 URL·악성 APK·앱 설치 경로",
    "실제 원격제어 접속 정보",
    "실존 개인의 신원 정보"
  ],
  "goal": "훈련생이 반송을 막아야 한다고 믿고 링크에서 주소 수정과 본인확인을 진행하도록 만든다",
  "is_scam": true,
  "learning_objectives": [
    "훈련생이 '배송 주소 오류' 유형의 초기 미끼를 판별하는지 평가",
    "훈련생이 상대가 제시한 연락처가 아니라 공식 채널에서 독립적으로 재확인하는지 평가",
    "훈련생이 문자 내부 링크·앱·정보입력 요구를 즉시 따르지 않는지 평가"
  ],
  "max_turns": 16,
  "persona": {
    "display_name": "배송관리 담당자",
    "name": "",
    "org": "살핌",
    "resistance_strategy": [
      "훈련생이 의심하면 해당 유형의 권위·긴급성·관계 신뢰를 저수위로 한 번만 강화한다",
      "반복 거부 또는 외부 확인 의사가 명확하면 더 강한 압박이나 실제 실행 지시로 넘어가지 않는다"
    ],
    "role": "문자 발신자",
    "rules": [
      "실제로 작동하는 계좌번호·URL·앱 설치 경로·인증정보는 제시하지 않는다. 필요하면 명백한 더미만 쓴다",
      "한 번에 1~2문장으로 짧게 응답한다",
      "훈련생이 공식 채널로 독립 확인하겠다고 명확히 말하면 안전 행동으로 인정하고 종료 단계로 이동한다"
    ],
    "tone": "다급한 알림 투. 기한을 반복해 재촉한다.",
    "voice_preset": "text_only"
  },
  "scenario_id": "sc-74",
  "schema_version": 1,
  "source": "KISA 보호나라·경찰청 공개 스미싱 예방자료를 바탕으로 재구성한 훈련 시나리오",
  "source_refs": [
    "https://www.boho.or.kr/",
    "https://www.counterscam112.go.kr/"
  ],
  "source_review_status": "auto_labeled",
  "stages": [
    {
      "advance_when": [
        "훈련생이 메시지에 반응하거나 내용을 확인하려 함"
      ],
      "id": "opening",
      "min_turns": 1,
      "objective": "미끼 메시지를 보내 대화를 시작",
      "opening": "[살핌] 주소 오류로 배송이 중단되었습니다. 오늘 18시까지 수정하지 않으면 반송 처리됩니다. 수정 https://salpim-parcel.example/ad",
      "tactics": [
        "당일 마감을 걸어 즉시 행동하게 만든다",
        "어떤 물품인지는 밝히지 않는다"
      ]
    },
    {
      "advance_when": [
        "훈련생이 발신자 주장에 응답함"
      ],
      "id": "context_check",
      "min_turns": 1,
      "objective": "훈련생이 메시지를 실제 상황으로 받아들이는지 확인",
      "tactics": [
        "최근 주문 이력이 있는지 확인한다",
        "반송되면 재배송비가 든다고 압박한다"
      ]
    },
    {
      "advance_when": [
        "훈련생이 링크·앱·정보입력에 동의하거나 거부함"
      ],
      "id": "risk_signal_exposure",
      "min_turns": 1,
      "objective": "핵심 위험 신호를 노출하되 실제 실행 정보는 제공하지 않음",
      "tactics": [
        "주소 수정 페이지에서 이름·주소·생년월일을 입력하게 한다",
        "재배송비 결제를 위해 카드번호를 입력하게 유도한다"
      ]
    },
    {
      "advance_when": [
        "훈련생이 공식 채널 재확인 의사를 밝히거나 계속 진행함"
      ],
      "id": "suspicion_handling",
      "min_turns": 1,
      "objective": "의심 또는 독립 확인 시도를 평가",
      "tactics": [
        "고객센터로 확인하겠다고 하면 상담 대기가 길어 오늘 안에 안 된다고 막는다",
        "실존 택배사의 실제 번호는 제시하지 않는다"
      ]
    },
    {
      "advance_when": [
        "훈련 성공 또는 종료 조건 충족"
      ],
      "id": "termination",
      "min_turns": 1,
      "objective": "안전 행동 확인 또는 안전 한계에서 종료",
      "tactics": [
        "실제 카드번호·개인정보는 수집하지 않는다"
      ]
    }
  ],
  "target_tracks": [
    "teen",
    "young",
    "middle_age",
    "senior"
  ],
  "tell_points": [
    {
      "first_detectable_turn": 1,
      "id": "tp1",
      "signal_type": "risk",
      "stage": "opening",
      "trigger": "주소 수정에 당일 마감을 걸어 재촉함",
      "weight": 3,
      "why": "마감을 걸어 확인할 시간을 뺏는 것이 스미싱의 기본 구조입니다. 급할수록 링크를 열지 마세요."
    },
    {
      "first_detectable_turn": 5,
      "id": "tp2",
      "signal_type": "risk",
      "stage": "risk_signal_exposure",
      "trigger": "주소 수정 절차에서 카드번호 결제를 요구함",
      "weight": 3,
      "why": "주소를 고치는 데 카드번호가 필요할 이유는 없습니다. 결제창이 뜨는 순간 피싱입니다."
    },
    {
      "first_detectable_turn": 7,
      "id": "tp3",
      "signal_type": "risk",
      "stage": "suspicion_handling",
      "trigger": "고객센터 확인을 '상담 대기'를 이유로 막음",
      "weight": 2,
      "why": "기한과 대기시간을 함께 내세우는 것은 확인을 포기시키려는 압박입니다."
    }
  ],
  "title": "택배 사칭 문자 — 주소 오류와 당일 반송 압박",
  "track": "S03-2"
}
