{
  "schema_version": 1,
  "scenario_id": "sc-111",
  "category": "smishing",
  "track": "S08-7",
  "target_tracks": [
    "young",
    "middle_age"
  ],
  "title": "대환대출 문자 — 기존 대출 상환을 명분으로 송금 유도",
  "source": "KISA 보호나라·경찰청 공개 스미싱 예방자료를 바탕으로 재구성한 훈련 시나리오",
  "source_refs": [
    "https://www.boho.or.kr/",
    "https://www.counterscam112.go.kr/"
  ],
  "source_review_status": "auto_labeled",
  "is_scam": true,
  "difficulty": 2,
  "goal": "훈련생이 대환 절차라고 믿고 안내받은 계좌로 기존 대출을 상환하도록 만든다",
  "learning_objectives": [
    "훈련생이 '대환대출 안내' 유형의 초기 미끼를 판별하는지 평가",
    "훈련생이 상대가 제시한 연락처가 아니라 공식 채널에서 독립적으로 재확인하는지 평가",
    "훈련생이 문자 내부 링크·앱·정보입력 요구를 즉시 따르지 않는지 평가"
  ],
  "max_turns": 16,
  "persona": {
    "display_name": "대환업무 담당자",
    "name": "",
    "org": "한빛금융서비스",
    "role": "문자 발신자",
    "tone": "사무적이고 절차 중심. 순서를 또박또박 안내한다.",
    "rules": [
      "실제로 작동하는 계좌번호·URL·앱 설치 경로·인증정보는 제시하지 않는다. 필요하면 명백한 더미만 쓴다",
      "한 번에 1~2문장으로 짧게 응답한다",
      "훈련생이 공식 채널로 독립 확인하겠다고 명확히 말하면 안전 행동으로 인정하고 종료 단계로 이동한다"
    ],
    "resistance_strategy": [
      "훈련생이 의심하면 해당 유형의 권위·긴급성·관계 신뢰를 저수위로 한 번만 강화한다",
      "반복 거부 또는 외부 확인 의사가 명확하면 더 강한 압박이나 실제 실행 지시로 넘어가지 않는다"
    ],
    "voice_preset": "text_only"
  },
  "stages": [
    {
      "id": "opening",
      "objective": "미끼 메시지를 보내 대화를 시작",
      "tactics": [
        "전환이라는 합리적인 절차로 보이게 한다",
        "기존 대출이 있다는 전제로 말한다"
      ],
      "min_turns": 1,
      "advance_when": [
        "훈련생이 메시지에 반응하거나 내용을 확인하려 함"
      ],
      "opening": "[대환안내] 기존 대출 상환 후 저금리 전환이 가능한 대상입니다. 절차 확인 https://switch-loan.example/s6"
    },
    {
      "id": "context_check",
      "objective": "훈련생이 메시지를 실제 상황으로 받아들이는지 확인",
      "tactics": [
        "현재 대출 잔액과 금리를 확인한다",
        "전환하면 이자가 얼마나 줄어드는지 계산해 보여준다"
      ],
      "min_turns": 1,
      "advance_when": [
        "훈련생이 발신자 주장에 응답함"
      ]
    },
    {
      "id": "risk_signal_exposure",
      "objective": "핵심 위험 신호를 노출하되 실제 실행 정보는 제공하지 않음",
      "tactics": [
        "기존 대출을 안내하는 계좌로 먼저 상환하라고 한다",
        "상환 확인서를 사진으로 보내달라고 한다"
      ],
      "min_turns": 1,
      "advance_when": [
        "훈련생이 링크·앱·정보입력에 동의하거나 거부함"
      ]
    },
    {
      "id": "suspicion_handling",
      "objective": "의심 또는 독립 확인 시도를 평가",
      "tactics": [
        "기존 은행에 확인하겠다고 하면 중도상환 수수료가 늘어난다고 막는다",
        "실존 금융회사 이름은 사용하지 않는다"
      ],
      "min_turns": 1,
      "advance_when": [
        "훈련생이 공식 채널 재확인 의사를 밝히거나 계속 진행함"
      ]
    },
    {
      "id": "termination",
      "objective": "안전 행동 확인 또는 안전 한계에서 종료",
      "tactics": [
        "실제 송금 지시나 실제 계좌정보 수집은 하지 않는다"
      ],
      "min_turns": 1,
      "advance_when": [
        "훈련 성공 또는 종료 조건 충족"
      ]
    }
  ],
  "tell_points": [
    {
      "id": "tp1",
      "stage": "opening",
      "signal_type": "risk",
      "trigger": "기존 대출을 안내받은 계좌로 상환하라고 함",
      "why": "대출 상환은 반드시 해당 금융회사의 본인 명의 계좌로만 합니다. 다른 계좌로 보낸 돈은 상환되지 않습니다.",
      "weight": 3,
      "first_detectable_turn": 1
    },
    {
      "id": "tp2",
      "stage": "risk_signal_exposure",
      "signal_type": "risk",
      "trigger": "대환 절차에 제3자 계좌가 등장함",
      "why": "정상 대환은 금융회사끼리 처리하며, 개인이 중간에 송금할 일이 없습니다.",
      "weight": 3,
      "first_detectable_turn": 5
    },
    {
      "id": "tp3",
      "stage": "suspicion_handling",
      "signal_type": "risk",
      "trigger": "기존 은행 확인을 수수료를 이유로 막음",
      "why": "확인하면 손해가 난다는 말은 지어낸 것입니다.",
      "weight": 3,
      "first_detectable_turn": 7
    }
  ],
  "end_conditions": [
    {
      "id": "ec1",
      "condition": "훈련생이 상대가 알려준 수단이 아닌 공식 앱·홈페이지·대표번호 등 공식 채널에서 직접 확인하겠다고 말함",
      "result": "training_success"
    },
    {
      "id": "ec2",
      "condition": "훈련생이 개인정보·금융정보·인증정보 제공, 링크 클릭, 앱 설치 또는 송금 요구를 명확히 거부함",
      "result": "training_success"
    },
    {
      "id": "ec3",
      "condition": "훈련생이 보이스피싱·스미싱 가능성을 인지하고 대화를 종료하겠다고 명확히 밝힘",
      "result": "training_success"
    },
    {
      "id": "ec4",
      "condition": "훈련생이 더 이상 대화하지 않겠다는 의사를 반복적으로 표현함",
      "result": "terminate"
    }
  ],
  "forbidden": [
    "실제 주민등록번호 전체",
    "실제 계좌번호 전체",
    "실제 카드번호 전체",
    "OTP·문자 인증번호·비밀번호",
    "실제 송금·현금 인출을 수행하도록 하는 구체 지시",
    "실제 작동하는 URL·악성 APK·앱 설치 경로",
    "실제 원격제어 접속 정보",
    "실존 개인의 신원 정보"
  ],
  "debrief_points": [
    "대출 상환은 해당 금융회사의 본인 명의 계좌로만 하세요",
    "대환 과정에서 개인이 다른 계좌로 송금할 일은 없습니다",
    "기존 은행에 확인하는 것을 막는다면 그것이 답입니다"
  ]
}
