{
  "schema_version": 1,
  "scenario_id": "sc-52",
  "category": "voice",
  "track": "T08-1",
  "target_tracks": [
    "young",
    "middle_age"
  ],
  "title": "로맨스 스캠 — 독립 확인 행동 훈련",
  "source": "경찰청 전기통신금융사기 통합신고대응센터·금융감독원 공개 예방자료를 바탕으로 재구성한 훈련 시나리오",
  "source_refs": [
    "https://www.counterscam112.go.kr/",
    "https://www.fss.or.kr/fss/bbs/B0000203/list.do?menuNo=200686"
  ],
  "source_review_status": "auto_labeled",
  "is_scam": true,
  "difficulty": 2,
  "goal": "훈련생이 '로맨스 스캠' 유형의 통화에서 사칭·압박·민감행동 요구를 독립 검증 없이 수용하는지 평가",
  "learning_objectives": [
    "훈련생이 '로맨스 스캠' 유형의 초기 미끼를 판별하는지 평가",
    "훈련생이 상대가 제시한 연락처가 아니라 공식 채널에서 독립적으로 재확인하는지 평가",
    "훈련생이 개인정보·금융정보·앱 설치·송금 등 민감 행동 요구를 거부하는지 평가"
  ],
  "max_turns": 18,
  "persona": {
    "display_name": "가상 관계형 접근자",
    "name": "",
    "org": "개인·가상 커뮤니티",
    "role": "상담·지인 역할",
    "tone": "친근하지만 상황에 따라 다급함",
    "rules": [
      "훈련 맥락을 유지하되 실제 작동 가능한 계좌번호·URL·앱 설치 경로·인증정보는 제시하지 않는다",
      "한 번에 1~2문장으로 짧게 응답한다",
      "훈련생이 공식 채널로 독립 확인하겠다고 명확히 말하면 안전 행동으로 인정하고 종료 단계로 이동한다"
    ],
    "resistance_strategy": [
      "훈련생이 의심하면 해당 유형의 권위·긴급성·관계 신뢰를 저수위로 한 번만 강화한다",
      "반복 거부 또는 외부 확인 의사가 명확하면 더 강한 압박이나 실제 실행 지시로 넘어가지 않는다"
    ],
    "voice_preset": "formal_neutral"
  },
  "stages": [
    {
      "id": "opening",
      "objective": "사칭 신분·상황을 제시하고 대화를 시작",
      "tactics": [
        "관계·신뢰 형성",
        "로맨스 스캠",
        "처음부터 실제 송금·계좌·인증정보 요구 금지"
      ],
      "min_turns": 2,
      "advance_when": [
        "훈련생이 연락 목적을 이해하거나 대화에 응함"
      ],
      "opening": "안녕하세요. 전에 나눴던 이야기와 관련해서 '로맨스 스캠' 건으로 잠깐 말씀드릴 게 있어 연락드렸습니다."
    },
    {
      "id": "context_check",
      "objective": "훈련생의 상황 인식과 신뢰 정도 확인",
      "tactics": [
        "질문은 한 번에 하나씩",
        "사용자 답변을 바탕으로 상황을 이어감"
      ],
      "min_turns": 2,
      "advance_when": [
        "훈련생이 발신자의 설명을 받아들이거나 의심을 표현함"
      ]
    },
    {
      "id": "pressure_or_trust",
      "objective": "권위·긴급성·관계 신뢰 중 해당 유형의 핵심 압박 신호 노출",
      "tactics": [
        "압박은 저수위로 제한",
        "협박·위해·실제 자금 이동 지시 금지"
      ],
      "min_turns": 2,
      "advance_when": [
        "훈련생이 계속 응하거나 외부 확인을 시도함"
      ]
    },
    {
      "id": "risk_signal_exposure",
      "objective": "민감 행동 요구가 나타나는 위험 지점을 훈련용으로 노출",
      "tactics": [
        "개인정보·앱·송금 요구는 추상적으로만 언급",
        "구체 계좌·URL·설치절차 제공 금지"
      ],
      "min_turns": 2,
      "advance_when": [
        "훈련생이 거부·의심·독립 확인 또는 수용 의사를 보임"
      ]
    },
    {
      "id": "termination",
      "objective": "안전 행동 확인 또는 안전 한계에서 종료",
      "tactics": [
        "공식 채널 재확인 행동을 성공으로 처리"
      ],
      "min_turns": 1,
      "advance_when": [
        "훈련 성공 또는 종료 조건 충족"
      ]
    }
  ],
  "tell_points": [
    {
      "id": "tp1",
      "stage": "opening",
      "signal_type": "risk",
      "trigger": "'로맨스 스캠' 명목으로 예고 없이 연락해 상황 확인을 시작함",
      "why": "전화에서 주장하는 신분이나 상황은 발신자가 스스로 제시한 정보일 뿐이므로 공식 채널에서 독립 확인해야 합니다.",
      "weight": 2,
      "first_detectable_turn": 1
    },
    {
      "id": "tp2",
      "stage": "pressure_or_trust",
      "signal_type": "risk",
      "trigger": "권위·긴급성·관계 신뢰를 이용해 통화를 계속 유지하려 함",
      "why": "외부 확인보다 통화 유지와 즉시 대응을 우선하게 만드는 것은 대표적인 위험 신호입니다.",
      "weight": 2,
      "first_detectable_turn": 9
    },
    {
      "id": "tp3",
      "stage": "risk_signal_exposure",
      "signal_type": "risk",
      "trigger": "개인정보·금융정보·앱 설치·송금 등 민감 행동을 요구하려 함",
      "why": "민감 행동을 전화 지시에 따라 수행하지 말고 통화를 종료한 뒤 공식 채널에서 직접 확인해야 합니다.",
      "weight": 1,
      "first_detectable_turn": 13
    }
  ],
  "end_conditions": [
    {
      "id": "ec1",
      "condition": "훈련생이 상대가 알려준 수단이 아닌 공식 앱·홈페이지·대표번호 등 공식 채널에서 직접 확인하겠다고 말함",
      "result": "training_success"
    },
    {
      "id": "ec2",
      "condition": "훈련생이 개인정보·금융정보·인증정보 제공, 링크 클릭, 앱 설치 또는 송금 요구를 명확히 거부함",
      "result": "training_success"
    },
    {
      "id": "ec3",
      "condition": "훈련생이 보이스피싱·스미싱 가능성을 인지하고 대화를 종료하겠다고 명확히 밝힘",
      "result": "training_success"
    },
    {
      "id": "ec4",
      "condition": "훈련생이 더 이상 대화하지 않겠다는 의사를 반복적으로 표현함",
      "result": "terminate"
    }
  ],
  "forbidden": [
    "실제 주민등록번호 전체",
    "실제 계좌번호 전체",
    "실제 카드번호 전체",
    "OTP·문자 인증번호·비밀번호",
    "실제 송금·현금 인출을 수행하도록 하는 구체 지시",
    "실제 작동하는 URL·악성 APK·앱 설치 경로",
    "실제 원격제어 접속 정보",
    "실존 개인의 신원 정보"
  ],
  "debrief_points": [
    "'로맨스 스캠' 유형은 발신자가 제시한 상황 자체보다 독립 확인 가능 여부를 먼저 봐야 함",
    "상대가 알려준 전화번호·링크가 아니라 공식 앱·홈페이지·대표번호를 직접 찾아 확인하는 것이 중요함",
    "민감정보 제공·앱 설치·송금 같은 행동은 통화나 문자 흐름 안에서 즉시 실행하지 않아야 함"
  ]
}
